<server-conf xmlns="http://sj-http-server.googlecode.com/server"
    xmlns:xsi="http://www.w3.org/2001/XMLSchema-instance"
    xsi:schemaLocation="http://sj-http-server.googlecode.com/server ../etc/sj-http-server.xsd">
	<listen-interface>any</listen-interface>
        <listen-port>9090</listen-port>
        <www-path>../www/</www-path>
        <handlers>
		<handler>
			<name>Fortune Teller</name>
			<description>Presents a random Fortune Cookie Quote.</description>
			<context-root>fortune-cookie</context-root>
			<file-path>../fortune-teller/libfortune-teller.so</file-path>
		</handler>
		<handler>
			<name>Image Gallery</name>
			<description>Allows to view and upload images.</description>
			<context-root>image-gallery</context-root>
			<file-path>../image-gallery/libimage-gallery.so</file-path>
			<init-params>
				<init-param>
					<name>image.store.directory</name>
					<value>../work/image-gallery/</value>
				</init-param>
                                <init-param>
                                        <name>create.thumbnails</name>
                                        <value>false</value>
                                </init-param>
			</init-params>
		</handler>
	</handlers>
</server-conf>
